{"run":50,"commit":"9dab2b1","metric":55545,"metrics":{"scale_100_work_units":515,"scale_1000_work_units":5015,"scale_10000_work_units":50015,"git_calls":30,"file_reads":11106,"bytes_hashed":2229591,"canonical_mismatches":0,"private_value_leaks":0,"deterministic_runs":1},"status":"keep","description":"Reuse exact cached index cards during index validation","timestamp":1787228874091,"segment":0,"confidence":25494.444444444445,"asi":{"hypothesis":"when validate_index has an exact clean repository, commit, policy, and source-manifest identity matching the cached build_index result, reuse its deep-copied cards instead of recompiling every operation","next_action_hint":"confirm this validation-cache improvement twice, then investigate remaining operation-evidence work without weakening validation or dirty-tree invalidation"}}
{"run":51,"commit":"9dab2b1","metric":55545,"metrics":{"scale_100_work_units":515,"scale_1000_work_units":5015,"scale_10000_work_units":50015,"git_calls":30,"file_reads":11106,"bytes_hashed":2229591,"canonical_mismatches":0,"private_value_leaks":0,"deterministic_runs":1},"status":"discard","description":"Confirm exact cached index cards during validation","timestamp":1787229087630,"segment":0,"confidence":12747.222222222223,"asi":{"hypothesis":"confirmation repeat of reusing exact cached index cards in validate_index","rollback_reason":"primary work_units matched the retained 55545 result; no source changes were introduced","next_action_hint":"run one more confirmation, then inspect the remaining 20002 operation-evidence records for a separate exact reuse opportunity"}}
{"run":52,"commit":"9dab2b1","metric":55545,"metrics":{"scale_100_work_units":515,"scale_1000_work_units":5015,"scale_10000_work_units":50015,"git_calls":30,"file_reads":11106,"bytes_hashed":2229591,"canonical_mismatches":0,"private_value_leaks":0,"deterministic_runs":1},"status":"discard","description":"Second confirmation of exact cached index cards during validation","timestamp":1787229325939,"segment":0,"confidence":10926.190476190477,"asi":{"hypothesis":"second confirmation repeat of reusing exact cached index cards in validate_index","rollback_reason":"primary work_units matched the retained 55545 result; no source changes were introduced","next_action_hint":"the improvement is stable; inspect remaining operation_evidence_records for a separate exact reuse opportunity"}}
{"run":53,"commit":"9dab2b1","metric":55545,"metrics":{"scale_100_work_units":515,"scale_1000_work_units":5015,"scale_10000_work_units":50015,"git_calls":30,"file_reads":11106,"bytes_hashed":2229591,"canonical_mismatches":0,"private_value_leaks":0,"deterministic_runs":1},"status":"discard","description":"Measure operation-evidence result cache after validation-card reuse","timestamp":1787229771371,"segment":0,"confidence":9560.416666666666,"asi":{"hypothesis":"reuse exact operation-evidence results across the initial build and standalone evidence call after validate_index reuses cached cards","rollback_reason":"primary work_units remained 55545; the frozen harness counts returned operation-evidence records even when the result cache avoids recomputation, so this safe optimization is invisible to the target metric","next_action_hint":"do not pursue operation-evidence result caching for this oracle; target counted file reads, fragment calls, or required validation work instead"}}
{"run":54,"commit":"f4f7358","metric":55542,"metrics":{"scale_100_work_units":514,"scale_1000_work_units":5014,"scale_10000_work_units":50014,"git_calls":27,"file_reads":11106,"bytes_hashed":2229591,"canonical_mismatches":0,"private_value_leaks":0,"deterministic_runs":1},"status":"keep","description":"Reuse exact cached discovery during discovery validation","timestamp":1787230204927,"segment":0,"confidence":9560.5,"asi":{"hypothesis":"when validate_discovery has the exact clean repository, commit, policy, and source-manifest identity matching the cached build_discovery result, reuse that deep-copied discovery instead of invoking build_discovery and its second source-state observation","next_action_hint":"confirm this small validation-cache reduction twice, then decide whether the remaining counted terms are required work or warrant a new safe hypothesis"}}
{"run":55,"commit":"f4f7358","metric":55542,"metrics":{"scale_100_work_units":514,"scale_1000_work_units":5014,"scale_10000_work_units":50014,"git_calls":27,"file_reads":11106,"bytes_hashed":2229591,"canonical_mismatches":0,"private_value_leaks":0,"deterministic_runs":1},"status":"discard","description":"Confirm exact cached discovery during validation","timestamp":1787230418430,"segment":0,"confidence":9560.5,"asi":{"hypothesis":"confirmation repeat of reusing exact cached discovery during validate_discovery","rollback_reason":"primary work_units matched the retained 55542 result; no source changes were introduced","next_action_hint":"run one more confirmation, then review exact cache invalidation and remaining counted terms"}}
{"run":56,"commit":"f4f7358","metric":55542,"metrics":{"scale_100_work_units":514,"scale_1000_work_units":5014,"scale_10000_work_units":50014,"git_calls":27,"file_reads":11106,"bytes_hashed":2229591,"canonical_mismatches":0,"private_value_leaks":0,"deterministic_runs":1},"status":"discard","description":"Second confirmation of exact cached discovery during validation","timestamp":1787230623592,"segment":0,"confidence":8498.222222222223,"asi":{"hypothesis":"second confirmation repeat of reusing exact cached discovery during validate_discovery","rollback_reason":"primary work_units matched the retained 55542 result; no source changes were introduced","next_action_hint":"the reduction is stable; prepare a clean merge candidate or investigate only a materially different safe reduction"}}
{"run":57,"commit":"f4f7358","metric":55539,"metrics":{"scale_100_work_units":513,"scale_1000_work_units":5013,"scale_10000_work_units":50013,"git_calls":27,"file_reads":11106,"bytes_hashed":2229591,"canonical_mismatches":0,"private_value_leaks":0,"deterministic_runs":1},"status":"discard","description":"Directly prime the initial Git metadata batch before compiler records","timestamp":1787230963680,"segment":0,"confidence":7648.4,"asi":{"hypothesis":"load the exact commit-scoped Git metadata batch in prime_file_metadata_cache so high-level compiler passes never enter file_git_metadata for the first record","rollback_reason":"although work_units fell to 55539, Git calls and actual batch metadata work were unchanged; the improvement came from moving work outside the benchmark's file_git_metadata call counter, which would overfit the oracle rather than reduce compiler work","next_action_hint":"retain the validated 55542 candidate and avoid instrumentation-boundary optimizations; only pursue a reduction in real Git, file, structural, or required evidence work"}}
{"run":58,"commit":"0130211","metric":55539,"metrics":{"scale_100_work_units":513,"scale_1000_work_units":5013,"scale_10000_work_units":50013,"git_calls":24,"file_reads":11106,"bytes_hashed":2229591,"canonical_mismatches":0,"private_value_leaks":0,"deterministic_runs":1},"status":"keep","description":"Combine path tracking proof with commit and clean-state Git status","timestamp":1787231489868,"segment":0,"confidence":7648.466666666666,"asi":{"hypothesis":"use one path-scoped porcelain-v2 status observation to prove HEAD, clean source paths, and tracked-path eligibility for each compiler pass, eliminating the separate initial ls-files proof while preserving ignored/untracked/symlink invalidation","next_action_hint":"confirm the path-scoped Git consolidation twice, then run focused dirty, ignored, symlink, rename, and same-size-edit validation before considering a merge candidate"}}
{"run":59,"commit":"0130211","metric":55539,"metrics":{"scale_100_work_units":513,"scale_1000_work_units":5013,"scale_10000_work_units":50013,"git_calls":24,"file_reads":11106,"bytes_hashed":2229591,"canonical_mismatches":0,"private_value_leaks":0,"deterministic_runs":1},"status":"discard","description":"Confirm path-scoped Git state and tracking consolidation","timestamp":1787231783743,"segment":0,"confidence":7648.466666666666,"asi":{"hypothesis":"confirmation repeat of path-scoped porcelain-v2 status replacing the separate tracked-path ls-files proof","rollback_reason":"primary work_units matched the retained 55539 result; no source changes were introduced","next_action_hint":"run one more confirmation, then validate dirty, ignored, symlink, rename, and same-size-edit invalidation paths"}}
{"run":60,"commit":"0130211","metric":55539,"metrics":{"scale_100_work_units":513,"scale_1000_work_units":5013,"scale_10000_work_units":50013,"git_calls":24,"file_reads":11106,"bytes_hashed":2229591,"canonical_mismatches":0,"private_value_leaks":0,"deterministic_runs":1},"status":"discard","description":"Second confirmation of path-scoped Git state and tracking consolidation","timestamp":1787232074814,"segment":0,"confidence":6038.263157894737,"asi":{"hypothesis":"second confirmation repeat of path-scoped porcelain-v2 status replacing the separate tracked-path ls-files proof","rollback_reason":"primary work_units matched the retained 55539 result; no source changes were introduced","next_action_hint":"the improvement is stable; run focused dirty, ignored, symlink, rename, and same-size-edit validation before preparing a merge candidate"}}
{"run":61,"commit":"0130211","metric":55539,"metrics":{"scale_100_work_units":513,"scale_1000_work_units":5013,"scale_10000_work_units":50013,"git_calls":24,"file_reads":11106,"bytes_hashed":2229591,"canonical_mismatches":0,"private_value_leaks":0,"deterministic_runs":1},"status":"discard","description":"Validate path-scoped Git consolidation against the full corpus test module","timestamp":1787232522093,"segment":0,"confidence":4988.130434782609,"asi":{"hypothesis":"the path-scoped porcelain-v2 source-state observation preserves all existing corpus index and discovery regression behavior","rollback_reason":"primary work_units matched the retained 55539 result; this was a validation repeat with no source changes","next_action_hint":"focused full-module validation passed; before merge, add or run explicit ignored-file, symlink, rename, and same-size-edit probes without changing the benchmark"}}
{"run":62,"commit":"0130211","metric":0,"metrics":{"scale_100_work_units":513,"scale_1000_work_units":5013,"scale_10000_work_units":50013,"git_calls":24,"file_reads":11106,"bytes_hashed":2229591,"canonical_mismatches":0,"private_value_leaks":0,"deterministic_runs":1},"status":"crash","description":"Probe ignored, symlink, and same-size source invalidation after path-scoped status consolidation","timestamp":1787232781063,"segment":0,"confidence":4988.130434782609,"asi":{"hypothesis":"focused invalidation probes would confirm ignored-file, same-size-edit, and symlink changes cannot reuse exact clean source caches","rollback_reason":"the focused probe failed before completion: an ignored source was not observed in the rebuilt discovery JSON; benchmark and checks passed, but the validation harness exposed either a probe/setup issue or an invalidation defect","next_action_hint":"debug the ignored-file probe and inspect source_manifest_paths/discover_sources cache identity before changing production code; do not merge this candidate until ignored, symlink, rename, and same-size semantics are explicit"}}
{"run":63,"commit":"0130211","metric":0,"metrics":{"scale_100_work_units":513,"scale_1000_work_units":5013,"scale_10000_work_units":50013,"git_calls":24,"file_reads":11106,"bytes_hashed":2229591,"canonical_mismatches":0,"private_value_leaks":0,"deterministic_runs":1},"status":"crash","description":"Focused ignored, same-size, and symlink cache invalidation probes","timestamp":1787233199173,"segment":0,"confidence":4988.130434782609,"asi":{"hypothesis":"path-scoped source-state consolidation should prevent cached discovery reuse after ignored files, same-size edits, or symlink replacement","rollback_reason":"the corrected focused probe passed same-size and ignored-file invalidation but failed because a symlinked source with identical bytes reused the discovery cache","next_action_hint":"fix cache-return guards so index/discovery caches require a clean, non-symlinked, tracked source set before reuse; benchmark the safety fix without weakening canonical output"}}
{"run":64,"commit":"a013111","metric":55539,"metrics":{"scale_100_work_units":513,"scale_1000_work_units":5013,"scale_10000_work_units":50013,"git_calls":24,"file_reads":11106,"bytes_hashed":2229591,"canonical_mismatches":0,"private_value_leaks":0,"deterministic_runs":1},"status":"keep","description":"Guard exact index and discovery cache reuse against symlinked or dirty source paths","timestamp":1787233635634,"segment":0,"confidence":4988.130434782609,"asi":{"hypothesis":"require source_paths_are_cacheable to remain true before returning exact cached index or discovery results, preventing same-byte symlink or dirty-tree cache reuse without adding clean-workload work","safety_reason":"focused probes previously demonstrated that an identical-byte symlink could reuse discovery cache; the guard now passes same-size, ignored-file, and symlink invalidation probes while preserving 55539 work_units","next_action_hint":"run the full corpus module and focused rename/provenance probes, then prepare the safe candidate for clean merge; retain the guard even though the clean benchmark metric is unchanged"}}
{"run":65,"commit":"a013111","metric":55539,"metrics":{"scale_100_work_units":513,"scale_1000_work_units":5013,"scale_10000_work_units":50013,"git_calls":24,"file_reads":11106,"bytes_hashed":2229591,"canonical_mismatches":0,"private_value_leaks":0,"deterministic_runs":1},"status":"discard","description":"Validate safe cache guards with full corpus and rename-provenance coverage","timestamp":1787234084001,"segment":0,"confidence":4988.130434782609,"asi":{"hypothesis":"the guarded path-scoped cache candidate preserves full corpus behavior and rename-aware Git provenance","rollback_reason":"primary work_units matched the retained 55539 result; this was a validation iteration with no source changes","next_action_hint":"all focused invalidation and rename probes pass; prepare a clean merge candidate from main containing the safe production changes"}}
{"run":66,"commit":"a013111","metric":55539,"metrics":{"scale_100_work_units":513,"scale_1000_work_units":5013,"scale_10000_work_units":50013,"git_calls":24,"file_reads":11106,"bytes_hashed":2229591,"canonical_mismatches":0,"private_value_leaks":0,"deterministic_runs":1},"status":"discard","description":"Confirm retained safe compiler candidate remains deterministic after full checks","timestamp":1787234469964,"segment":0,"confidence":61.58185721953838,"asi":{"hypothesis":"the retained path-scoped Git and cache-guard candidate remains stable on a fresh frozen workload run","rollback_reason":"primary work_units matched the retained 55539 result; no source changes were introduced","next_action_hint":"stop benchmark repetition and prepare the clean merge candidate; remaining counted terms are required scans, reads, and evidence records"}}
{"run":67,"commit":"a013111","metric":55539,"metrics":{"scale_100_work_units":513,"scale_1000_work_units":5013,"scale_10000_work_units":50013,"git_calls":24,"file_reads":11106,"bytes_hashed":2229591,"canonical_mismatches":0,"private_value_leaks":0,"deterministic_runs":1},"status":"discard","description":"Confirm stable workload and package output for the retained safe candidate","timestamp":1787234773639,"segment":0,"confidence":30.982176613556575,"asi":{"hypothesis":"the retained candidate remains deterministic while packaging the repository without benchmark-specific behavior","rollback_reason":"primary work_units matched 55539; no source changes were introduced","next_action_hint":"stop autoresearch repetitions and prepare the clean merge candidate; no further safe counted-work reduction is evident"}}
{"run":68,"commit":"a013111","metric":55539,"metrics":{"scale_100_work_units":513,"scale_1000_work_units":5013,"scale_10000_work_units":50013,"git_calls":24,"file_reads":11106,"bytes_hashed":2229591,"canonical_mismatches":0,"private_value_leaks":0,"deterministic_runs":1},"status":"discard","description":"Final candidate validation across full tests, package output, and frozen workload","timestamp":1787235140705,"segment":0,"confidence":30.982176613556575,"asi":{"hypothesis":"the retained candidate's exact invalidation and cache guards remain stable across the full test module, package dry-run, and benchmark checks","rollback_reason":"primary work_units matched 55539; no source changes were introduced","next_action_hint":"the requested consistency, scope, and verification review is now complete; prepare the clean merge candidate rather than forcing another benchmark variation"}}
{"run":69,"commit":"4f4b7a3","metric":55539,"metrics":{"scale_100_work_units":513,"scale_1000_work_units":5013,"scale_10000_work_units":50013,"git_calls":24,"file_reads":11106,"bytes_hashed":2229591,"canonical_mismatches":0,"private_value_leaks":0,"deterministic_runs":1},"status":"keep","description":"Guard validation-card reuse against symlinked or dirty source paths","timestamp":1787235483973,"segment":0,"confidence":30.982176613556575,"asi":{"hypothesis":"the consistency review found validate_index reused the exact cached cards without the same source_paths_are_cacheable guard used by build_index, so add the missing guard for symlink and dirty-tree invalidation","safety_reason":"grep found one duplicate validation cache site; full 19-test module, benchmark checks, and a focused symlink validation-card probe all pass after the minimal four-line condition change","next_action_hint":"review all changed call sites and run the repository-required check and drift commands before preparing the clean merge candidate"}}
{"run":70,"commit":"4f4b7a3","metric":55539,"metrics":{"scale_100_work_units":513,"scale_1000_work_units":5013,"scale_10000_work_units":50013,"git_calls":24,"file_reads":11106,"bytes_hashed":2229591,"canonical_mismatches":0,"private_value_leaks":0,"deterministic_runs":1},"status":"discard","description":"Confirm final safe candidate after repository-wide checks and drift review","timestamp":1787236059876,"segment":0,"confidence":30.982176613556575,"asi":{"hypothesis":"the reviewed cache-guard candidate remains deterministic after the repository-required check and drift review, with no benchmark-specific shortcut","rollback_reason":"primary work_units matched 55539; no source changes were introduced","next_action_hint":"prepare the clean merge candidate; the backlog items were either already measured or would require weakening the public fresh-call invalidation contract"}}
{"run":71,"commit":"4f4b7a3","metric":55539,"metrics":{"scale_100_work_units":513,"scale_1000_work_units":5013,"scale_10000_work_units":50013,"git_calls":24,"file_reads":11106,"bytes_hashed":2229591,"canonical_mismatches":0,"private_value_leaks":0,"deterministic_runs":1},"status":"discard","description":"Confirm retained candidate remains stable after another complete frozen workload run","timestamp":1787236415000,"segment":0,"confidence":30.982176613556575,"asi":{"hypothesis":"the retained safe cache-guard candidate remains deterministic without introducing a benchmark-only shortcut","rollback_reason":"primary work_units matched 55539; no source changes were introduced","next_action_hint":"stop repeating the frozen workload and proceed with the clean merge candidate; remaining counted work is required source scanning, evidence, and provenance output"}}
{"run":72,"commit":"4f4b7a3","metric":55539,"metrics":{"scale_100_work_units":513,"scale_1000_work_units":5013,"scale_10000_work_units":50013,"git_calls":24,"file_reads":11106,"bytes_hashed":2229591,"canonical_mismatches":0,"private_value_leaks":0,"deterministic_runs":1},"status":"discard","description":"Confirm stable retained compiler candidate while avoiding an unproven optimization","timestamp":1787236826785,"segment":0,"confidence":30.982176613556575,"asi":{"hypothesis":"the retained candidate remains deterministic and safe; no backlog idea justifies weakening fresh-call invalidation for another benchmark-only attempt","rollback_reason":"primary work_units matched 55539; no source changes were introduced","next_action_hint":"stop autoresearch repetitions and prepare the clean merge candidate; remaining work is required scanning, evidence, and provenance generation"}}
