{"type":"config","name":"Webflow compiler wave two","metricName":"work_units","metricUnit":"","bestDirection":"lower"}
{"run":1,"commit":"1d92d65","metric":399720,"metrics":{"scale_100_work_units":3640,"scale_1000_work_units":36040,"scale_10000_work_units":360040,"git_calls":7772,"file_reads":155462,"bytes_hashed":15622804,"canonical_mismatches":0,"private_value_leaks":0,"deterministic_runs":1},"status":"keep","description":"Untouched frozen scale baseline before compiler hypotheses","timestamp":1787208686152,"segment":0,"confidence":null,"asi":{"hypothesis":"untouched frozen scale baseline","baseline":true,"next_action_hint":"investigate repeated per-file Git metadata and source reads without changing benchmark assets"}}
{"run":2,"commit":"1d92d65","metric":399720,"metrics":{"scale_100_work_units":3640,"scale_1000_work_units":36040,"scale_10000_work_units":360040,"git_calls":7772,"file_reads":155462,"bytes_hashed":15622804,"canonical_mismatches":0,"private_value_leaks":0,"deterministic_runs":1},"status":"discard","description":"Guard fragment metadata lookup alone; metric unchanged because evidence_record has a separate lookup path","timestamp":1787209013964,"segment":0,"confidence":null,"asi":{"hypothesis":"cache.get guard in fragment_record only","rollback_reason":"primary work_units unchanged; the workload's evidence_record call site still performs the repeated lookup","next_action_hint":"apply the same cache guard consistently at evidence_record, then rerun the unchanged benchmark","consistency_finding":"file_git_metadata had two caller sites; partial fix was insufficient"}}
{"run":3,"commit":"1d92d65","metric":399720,"metrics":{"scale_100_work_units":3640,"scale_1000_work_units":36040,"scale_10000_work_units":360040,"git_calls":7772,"file_reads":155462,"bytes_hashed":15622804,"canonical_mismatches":0,"private_value_leaks":0,"deterministic_runs":1},"status":"discard","description":"Guard metadata lookups at both fragment and evidence record call sites; frozen scale has one record per file so work is unchanged","timestamp":1787209336471,"segment":0,"confidence":null,"asi":{"hypothesis":"avoid redundant file_git_metadata calls when cache already contains a path","rollback_reason":"primary work_units unchanged; this workload produces one metadata-bearing record per path per pass, so no duplicate caller calls exist to remove","next_action_hint":"profile repeated full discovery/evidence passes and target a valid cross-call cache or scan reduction rather than per-record guards","consistency_check":"both file_git_metadata call sites were patched together and grep confirmed no direct spread call remained"}}
{"run":4,"commit":"c777150","metric":355305,"metrics":{"scale_100_work_units":3235,"scale_1000_work_units":32035,"scale_10000_work_units":320035,"git_calls":6666,"file_reads":144357,"bytes_hashed":15622804,"canonical_mismatches":0,"private_value_leaks":0,"deterministic_runs":1},"status":"keep","description":"Cache deterministic index builds by repository, commit, policy, and source-manifest identity","timestamp":1787209703520,"segment":0,"confidence":null,"asi":{"hypothesis":"reuse a deep-copied build_index result when repository commit, policy hash, and source manifest hash are unchanged","gain":"work_units 399720 -> 355305; repeated index build skipped while manifest validation remains","safety":"full checks passed; uncommitted source mutation invalidation test remained green; canonical output and privacy gates unchanged","next_action_hint":"benchmark a similarly bounded build_discovery cache, then confirm the best candidate repeatedly before more complex caching"}}
{"run":5,"commit":"11ad6f4","metric":266505,"metrics":{"scale_100_work_units":2435,"scale_1000_work_units":24035,"scale_10000_work_units":240035,"git_calls":4440,"file_reads":122357,"bytes_hashed":15622804,"canonical_mismatches":0,"private_value_leaks":0,"deterministic_runs":1},"status":"keep","description":"Cache deterministic discovery builds by repository, commit, policy, and source-manifest identity","timestamp":1787209938042,"segment":0,"confidence":null,"asi":{"hypothesis":"reuse a deep-copied build_discovery result when repository commit, policy hash, and source manifest hash are unchanged","gain":"work_units 355305 -> 266505; repeated discovery scan skipped with the same invalidation identity as index caching","safety":"full compiler, scale, and hardening checks passed; output remained canonical and deterministic","next_action_hint":"confirm the combined cache candidate repeatedly, then inspect operation-evidence recomputation for a similarly bounded win"}}
{"run":6,"commit":"11ad6f4","metric":266505,"metrics":{"scale_100_work_units":2435,"scale_1000_work_units":24035,"scale_10000_work_units":240035,"git_calls":4440,"file_reads":122357,"bytes_hashed":15622804,"canonical_mismatches":0,"private_value_leaks":0,"deterministic_runs":1},"status":"discard","description":"Repeat combined index/discovery cache candidate for confirmation; deterministic work matched best","timestamp":1787210151152,"segment":0,"confidence":5.998649105032084,"asi":{"hypothesis":"confirmation repeat of combined repository/commit/policy/manifest caches","confirmation":true,"rollback_reason":"primary metric equal to current best; no candidate source changes were introduced in this confirmation","next_action_hint":"repeat once more to establish a stable lower-than-baseline distribution before changing architecture"}}
{"run":7,"commit":"11ad6f4","metric":266505,"metrics":{"scale_100_work_units":2435,"scale_1000_work_units":24035,"scale_10000_work_units":240035,"git_calls":4440,"file_reads":122357,"bytes_hashed":15622804,"canonical_mismatches":0,"private_value_leaks":0,"deterministic_runs":1},"status":"discard","description":"Second confirmation repeat of combined compiler caches; deterministic work matched the retained result","timestamp":1787210352666,"segment":0,"confidence":2.999324552516042,"asi":{"hypothesis":"second confirmation repeat of combined index and discovery caches","confirmation":true,"rollback_reason":"primary metric equal to best; no candidate source changes were introduced","next_action_hint":"complete additional confirmation coverage, then test a separate operation-evidence reuse hypothesis"}}
{"run":8,"commit":"11ad6f4","metric":266505,"metrics":{"scale_100_work_units":2435,"scale_1000_work_units":24035,"scale_10000_work_units":240035,"git_calls":4440,"file_reads":122357,"bytes_hashed":15622804,"canonical_mismatches":0,"private_value_leaks":0,"deterministic_runs":1},"status":"discard","description":"Third confirmation repeat of combined compiler caches; output and deterministic work remain stable","timestamp":1787210557345,"segment":0,"confidence":3.000337837837838,"asi":{"hypothesis":"third confirmation repeat of combined index and discovery caches","confirmation":true,"rollback_reason":"primary metric equal to best; no candidate source changes were introduced","next_action_hint":"the retained improvement is stable across repeats; explore operation-evidence cache reuse as a new isolated hypothesis"}}
{"run":9,"commit":"143735b","metric":222108,"metrics":{"scale_100_work_units":2036,"scale_1000_work_units":20036,"scale_10000_work_units":200036,"git_calls":33,"file_reads":122357,"bytes_hashed":15622804,"canonical_mismatches":0,"private_value_leaks":0,"deterministic_runs":1},"status":"keep","description":"Batch per-repository Git file metadata while preserving latest commit provenance","timestamp":1787210836513,"segment":0,"confidence":4.000540577066018,"asi":{"hypothesis":"populate the per-call metadata cache from one ordered Git log stream instead of one subprocess per source path","gain":"work_units 266505 -> 222108; Git calls 4440 -> 33 while metadata values and all hard checks stayed valid","safety":"full compiler, scale, hardening tests and canonical output checks passed","next_action_hint":"confirm the batch metadata result repeatedly and inspect edge cases such as untracked, renamed, and missing paths before further optimization"}}
{"run":10,"commit":"143735b","metric":222108,"metrics":{"scale_100_work_units":2036,"scale_1000_work_units":20036,"scale_10000_work_units":200036,"git_calls":33,"file_reads":122357,"bytes_hashed":15622804,"canonical_mismatches":0,"private_value_leaks":0,"deterministic_runs":1},"status":"discard","description":"Correct batch metadata to match current-branch Git semantics; metric unchanged but this is a required correctness repair","timestamp":1787211157939,"segment":0,"confidence":4.000540577066018,"asi":{"hypothesis":"remove --all from batched Git log so metadata cannot come from unreachable branches","rollback_reason":"primary work_units unchanged; the prior kept batch candidate used --all and could report provenance from another branch, so the metric-neutral correction must be landed separately rather than treated as an optimization win","next_action_hint":"reapply this semantic correction, run the full validate/compiler modules, and land it before the next performance hypothesis","consistency_finding":"ad hoc branch-isolation comparison proved --all differs from the original per-path current-branch contract"}}
{"run":11,"commit":"eb8ef34","metric":177711,"metrics":{"scale_100_work_units":1637,"scale_1000_work_units":16037,"scale_10000_work_units":160037,"git_calls":33,"file_reads":122357,"bytes_hashed":15622804,"canonical_mismatches":0,"private_value_leaks":0,"deterministic_runs":1},"status":"keep","description":"Reuse already-loaded metadata from the batch cache in both record builders","timestamp":1787211618181,"segment":0,"confidence":5.000540577066018,"asi":{"hypothesis":"make fragment_record and evidence_record read the shared metadata cache directly before invoking file_git_metadata","gain":"work_units 222108 -> 177711; metadata function calls 44409 -> 12 across scale sizes without changing records","safety":"full checks passed; all call sites were grepped and both duplicate builders were updated consistently","next_action_hint":"confirm the combined candidate and then investigate source text/read reuse, not further metadata call micro-variations"}}
{"run":12,"commit":"eb8ef34","metric":177711,"metrics":{"scale_100_work_units":1637,"scale_1000_work_units":16037,"scale_10000_work_units":160037,"git_calls":33,"file_reads":122357,"bytes_hashed":15622804,"canonical_mismatches":0,"private_value_leaks":0,"deterministic_runs":1},"status":"discard","description":"Confirm metadata cache reuse after branch-semantics correction; deterministic work matched the retained candidate","timestamp":1787211819659,"segment":0,"confidence":3.333693718044012,"asi":{"hypothesis":"confirmation repeat of batched current-branch metadata plus both cache-guard call sites","confirmation":true,"rollback_reason":"primary metric equal to best; no candidate source changes were introduced","next_action_hint":"run one more confirmation, then test a source-text reuse idea only if it preserves exact snapshot invalidation"}}
{"run":13,"commit":"eb8ef34","metric":177711,"metrics":{"scale_100_work_units":1637,"scale_1000_work_units":16037,"scale_10000_work_units":160037,"git_calls":33,"file_reads":122357,"bytes_hashed":15622804,"canonical_mismatches":0,"private_value_leaks":0,"deterministic_runs":1},"status":"discard","description":"Second confirmation of corrected metadata-cache candidate; deterministic output and work remain stable","timestamp":1787212021623,"segment":0,"confidence":2.500270288533009,"asi":{"hypothesis":"second confirmation repeat of current-branch batch metadata and cache-guard candidate","confirmation":true,"rollback_reason":"primary metric equal to best; no candidate source changes were introduced","next_action_hint":"candidate is stable; explore only source-identity-safe read reuse or simplification, with no benchmark changes"}}
{"run":14,"commit":"83e8418","metric":155505,"metrics":{"scale_100_work_units":1435,"scale_1000_work_units":14035,"scale_10000_work_units":140035,"git_calls":33,"file_reads":100053,"bytes_hashed":15622804,"canonical_mismatches":0,"private_value_leaks":0,"deterministic_runs":1},"status":"keep","description":"Reuse the exact source snapshot already hashed by build_index and build_discovery","timestamp":1787212355123,"segment":0,"confidence":2.7503547536995745,"asi":{"hypothesis":"carry source_manifest bytes through the same build call via the existing internal cache so later parser stages do not reread identical files","gain":"work_units 177711 -> 155505; file reads 122357 -> 100053 with bytes hashed and canonical outputs unchanged","safety":"full checks passed; snapshot is exact bytes from the manifest read and default paths remain unchanged for validation/direct callers","next_action_hint":"confirm snapshot reuse, then evaluate whether the explicit operation-evidence pass can consume a validated snapshot without weakening invalidation"}}
{"run":15,"commit":"83e8418","metric":155505,"metrics":{"scale_100_work_units":1435,"scale_1000_work_units":14035,"scale_10000_work_units":140035,"git_calls":33,"file_reads":100053,"bytes_hashed":15622804,"canonical_mismatches":0,"private_value_leaks":0,"deterministic_runs":1},"status":"discard","description":"Confirm source snapshot reuse; deterministic work and canonical output matched the retained candidate","timestamp":1787212562710,"segment":0,"confidence":2.7503547536995745,"asi":{"hypothesis":"confirmation repeat of exact source bytes carried from source_manifest into build parsing","confirmation":true,"rollback_reason":"primary metric equal to best; no candidate source changes were introduced","next_action_hint":"look for a semantically bounded reduction in explicit operation-evidence work or leave the stable snapshot unchanged"}}
{"run":16,"commit":"83e8418","metric":155505,"metrics":{"scale_100_work_units":1435,"scale_1000_work_units":14035,"scale_10000_work_units":140035,"git_calls":33,"file_reads":100053,"bytes_hashed":15622804,"canonical_mismatches":0,"private_value_leaks":0,"deterministic_runs":1},"status":"discard","description":"Repair batched metadata rename semantics with Git name-status mapping; metric unchanged but name-only batching was not behaviorally equivalent","timestamp":1787212888726,"segment":0,"confidence":3.667139671599432,"asi":{"hypothesis":"parse -M Git name-status output and map both rename/copy paths to the latest commit","rollback_reason":"primary work_units unchanged; the prior name-only batch candidate returned the wrong provenance for rename predecessors, violating the existing per-path contract","next_action_hint":"reapply the name-status parser, rerun the full corpus module and land the correctness repair before further experiments","consistency_finding":"ad hoc rename comparison showed both old and new paths must map to the rename commit"}}
{"run":17,"commit":"983885a","metric":88911,"metrics":{"scale_100_work_units":837,"scale_1000_work_units":8037,"scale_10000_work_units":80037,"git_calls":75,"file_reads":33315,"bytes_hashed":2229591,"canonical_mismatches":0,"private_value_leaks":0,"deterministic_runs":1},"status":"keep","description":"Cache clean tracked source manifests by commit and policy while preserving exact invalidation","timestamp":1787213650636,"segment":0,"confidence":7.000675721332523,"asi":{"hypothesis":"reuse the exact source-manifest hash and bytes only when Git reports a clean tracked tree, commit/policy/paths match, and no source path is a symlink","gain":"work_units 155505 -> 88911; bytes hashed 15622804 -> 2229591 and file reads 100053 -> 33315","safety":"full checks passed; dirty/untracked/symlink paths bypass the cache and validation still recomputes the current manifest identity","next_action_hint":"confirm clean-tree manifest caching and stress invalidation with same-size edits, untracked files, and symlinks before further work"}}
{"run":18,"commit":"397ca47","metric":66723,"metrics":{"scale_100_work_units":641,"scale_1000_work_units":6041,"scale_10000_work_units":60041,"git_calls":93,"file_reads":11109,"bytes_hashed":2229591,"canonical_mismatches":0,"private_value_leaks":0,"deterministic_runs":1},"status":"keep","description":"Reuse validated clean source snapshots for operation evidence","timestamp":1787214000179,"segment":0,"confidence":5.999945945945946,"asi":{"hypothesis":"when operation_evidence follows a clean tracked build, reuse the exact manifest snapshot only after matching repository commit, policy, path set, Git cleanliness, and symlink policy","gain":"work_units 88911 -> 66723; operation evidence no longer rereads the same clean source files","safety":"full checks passed; direct or dirty operation-evidence calls retain the original read path, and same-size/untracked/symlink invalidation was exercised separately","next_action_hint":"confirm the operation-evidence snapshot candidate, then inspect remaining Git status and metadata work for a similarly bounded reduction"}}
{"run":19,"commit":"397ca47","metric":66723,"metrics":{"scale_100_work_units":641,"scale_1000_work_units":6041,"scale_10000_work_units":60041,"git_calls":93,"file_reads":11109,"bytes_hashed":2229591,"canonical_mismatches":0,"private_value_leaks":0,"deterministic_runs":1},"status":"discard","description":"Confirm clean operation-evidence snapshot reuse; deterministic work matched the retained candidate","timestamp":1787214206636,"segment":0,"confidence":4.999729741903518,"asi":{"hypothesis":"confirmation repeat of validated clean-tree source snapshot reuse for operation evidence","rollback_reason":"primary work_units equal to current best; no candidate source changes were introduced","next_action_hint":"candidate is stable; inspect remaining metadata/status work and avoid unsafe cross-call reuse without exact invalidation"}}
{"run":20,"commit":"dbaf95d","metric":66699,"metrics":{"scale_100_work_units":633,"scale_1000_work_units":6033,"scale_10000_work_units":60033,"git_calls":69,"file_reads":11109,"bytes_hashed":2229591,"canonical_mismatches":0,"private_value_leaks":0,"deterministic_runs":1},"status":"keep","description":"Skip repeated tracked-path Git lookups after an exact clean-cache identity match","timestamp":1787214487508,"segment":0,"confidence":5.000653197288105,"asi":{"hypothesis":"reuse the initial tracked-path proof only when repository commit, policy, and discovered source paths exactly match; still query Git status on every reuse to detect working-tree changes","gain":"work_units 66723 -> 66699; repeated cache hits avoid six ls-files subprocesses per scale","safety":"full corpus module and complete checks passed; commit changes, path-set changes, untracked files, dirty files, and symlinks still prevent reuse","next_action_hint":"confirm the small Git-call reduction once, then focus on correctness regression coverage and remaining mandatory validation"}}
{"run":21,"commit":"dbaf95d","metric":66699,"metrics":{"scale_100_work_units":633,"scale_1000_work_units":6033,"scale_10000_work_units":60033,"git_calls":69,"file_reads":11109,"bytes_hashed":2229591,"canonical_mismatches":0,"private_value_leaks":0,"deterministic_runs":1},"status":"discard","description":"Confirm exact clean-cache tracked-path reuse; deterministic work matched the retained candidate","timestamp":1787214667753,"segment":0,"confidence":3.750489897966079,"asi":{"hypothesis":"confirmation repeat of skipping ls-files after an exact clean-cache identity match","rollback_reason":"primary work_units equal to current best; no candidate source changes were introduced","next_action_hint":"retain the small Git-call reduction and finish regression, consistency, and full repository validation"}}
{"run":22,"commit":"4f1e671","metric":66690,"metrics":{"scale_100_work_units":630,"scale_1000_work_units":6030,"scale_10000_work_units":60030,"git_calls":60,"file_reads":11109,"bytes_hashed":2229591,"canonical_mismatches":0,"private_value_leaks":0,"deterministic_runs":1},"status":"keep","description":"Share exact commit-scoped batched Git metadata across compiler passes","timestamp":1787215357539,"segment":0,"confidence":3.7505912561659573,"asi":{"hypothesis":"share the parsed rename-aware Git log only when callers provide the exact HEAD commit; direct callers without a commit retain per-call behavior","gain":"work_units 66699 -> 66690; Git log subprocesses fall from three to one per scale case","safety":"full corpus module and complete checks passed; metadata remains keyed to the current-branch full commit and unknown/untracked paths still return empty metadata","next_action_hint":"confirm commit-scoped metadata reuse, then stop micro-optimizing and perform final consistency, scope, and validation review"}}
{"run":23,"commit":"4f1e671","metric":66690,"metrics":{"scale_100_work_units":630,"scale_1000_work_units":6030,"scale_10000_work_units":60030,"git_calls":60,"file_reads":11109,"bytes_hashed":2229591,"canonical_mismatches":0,"private_value_leaks":0,"deterministic_runs":1},"status":"discard","description":"Confirm commit-scoped Git metadata sharing; deterministic work matched the retained candidate","timestamp":1787215542648,"segment":0,"confidence":3.7505912561659573,"asi":{"hypothesis":"confirmation repeat of sharing the parsed rename-aware Git log by exact repository and HEAD commit","rollback_reason":"primary work_units equal to current best; no candidate source changes were introduced","next_action_hint":"retain the metadata cache and move to final regression, consistency, scope, and repository validation"}}
