{"run":24,"commit":"9e0b5e4","metric":66681,"metrics":{"scale_100_work_units":627,"scale_1000_work_units":6027,"scale_10000_work_units":60027,"git_calls":60,"file_reads":11109,"bytes_hashed":2229591,"canonical_mismatches":0,"private_value_leaks":0,"deterministic_runs":1},"status":"keep","description":"Prime exact commit-scoped metadata maps before each compiler pass","timestamp":1787215802090,"segment":0,"confidence":3.750565897496537,"asi":{"hypothesis":"seed per-pass metadata caches directly from the already parsed exact HEAD map instead of calling the metadata accessor merely to initialize it","gain":"work_units 66690 -> 66681; file_git_metadata_calls fall from four to one per scale case","safety":"full corpus module and complete checks passed; unknown paths still receive empty metadata and direct callers without an exact commit keep the old lazy batch path","next_action_hint":"confirm metadata priming once, then stop micro-optimizing and perform final consistency, scope, and validation review"}}
{"run":25,"commit":"9e0b5e4","metric":66681,"metrics":{"scale_100_work_units":627,"scale_1000_work_units":6027,"scale_10000_work_units":60027,"git_calls":60,"file_reads":11109,"bytes_hashed":2229591,"canonical_mismatches":0,"private_value_leaks":0,"deterministic_runs":1},"status":"discard","description":"Confirm metadata cache priming; deterministic work matched the retained candidate","timestamp":1787215983663,"segment":0,"confidence":3.7504391891891893,"asi":{"hypothesis":"confirmation repeat of priming exact commit-scoped metadata maps before compiler passes","rollback_reason":"primary work_units equal to current best; no candidate source changes were introduced","next_action_hint":"retain metadata priming and finish final validation rather than adding broader caches"}}
{"run":26,"commit":"4b11f4f","metric":66654,"metrics":{"scale_100_work_units":618,"scale_1000_work_units":6018,"scale_10000_work_units":60018,"git_calls":33,"file_reads":11109,"bytes_hashed":2229591,"canonical_mismatches":0,"private_value_leaks":0,"deterministic_runs":1},"status":"keep","description":"Combine HEAD and clean-tree observation into one Git status query","timestamp":1787216547618,"segment":0,"confidence":3.3340941169404488,"asi":{"hypothesis":"replace separate rev-parse and status subprocesses with one exact porcelain-v2 branch/status observation, then reuse that observation only for the immediately keyed source manifest check","gain":"work_units 66681 -> 66654; Git calls 20 -> 11 per scale case","safety":"benchmark and complete checks passed; status still reports dirty/untracked worktrees, ignored source paths still require ls-files, and source cache identity remains commit/path/policy bound","next_action_hint":"confirm the combined source-state candidate on the frozen workload, then run final dirty/untracked/symlink and real-corpus validation"}}
{"run":27,"commit":"4b11f4f","metric":66654,"metrics":{"scale_100_work_units":618,"scale_1000_work_units":6018,"scale_10000_work_units":60018,"git_calls":33,"file_reads":11109,"bytes_hashed":2229591,"canonical_mismatches":0,"private_value_leaks":0,"deterministic_runs":1},"status":"discard","description":"Confirm combined HEAD and clean-tree source-state observation; deterministic work matched the retained candidate","timestamp":1787216727223,"segment":0,"confidence":3.750109778753589,"asi":{"hypothesis":"confirmation repeat of the porcelain-v2 source-state query replacing separate rev-parse and status calls","rollback_reason":"primary work_units equal to current best; no candidate source changes were introduced","next_action_hint":"retain the combined source-state optimization and run invalidation/real-corpus validation before any further hypothesis"}}
{"run":28,"commit":"4b11f4f","metric":66654,"metrics":{"scale_100_work_units":618,"scale_1000_work_units":6018,"scale_10000_work_units":60018,"git_calls":33,"file_reads":11109,"bytes_hashed":2229591,"canonical_mismatches":0,"private_value_leaks":0,"deterministic_runs":1},"status":"discard","description":"Second confirmation of combined source-state observation; deterministic work matched the retained candidate","timestamp":1787217007687,"segment":0,"confidence":3.750109778753589,"asi":{"hypothesis":"second confirmation repeat of porcelain-v2 HEAD and clean-tree observation reuse","rollback_reason":"primary work_units equal to current best; no candidate source changes were introduced","next_action_hint":"candidate is stable at 66654; avoid benchmark-specific shortcuts and retain the exact invalidation guards"}}
{"run":29,"commit":"4b11f4f","metric":66654,"metrics":{"scale_100_work_units":618,"scale_1000_work_units":6018,"scale_10000_work_units":60018,"git_calls":33,"file_reads":11109,"bytes_hashed":2229591,"canonical_mismatches":0,"private_value_leaks":0,"deterministic_runs":1},"status":"discard","description":"Third confirmation of combined source-state observation; deterministic work matched the retained candidate","timestamp":1787217202310,"segment":0,"confidence":3.750109778753589,"asi":{"hypothesis":"third confirmation repeat of porcelain-v2 HEAD and clean-tree observation reuse","rollback_reason":"primary work_units equal to current best; no candidate source changes were introduced","next_action_hint":"candidate is stable at 66654; avoid benchmark-specific shortcuts and preserve exact invalidation semantics"}}
{"run":30,"commit":"4b11f4f","metric":66654,"metrics":{"scale_100_work_units":618,"scale_1000_work_units":6018,"scale_10000_work_units":60018,"git_calls":33,"file_reads":11109,"bytes_hashed":2229591,"canonical_mismatches":0,"private_value_leaks":0,"deterministic_runs":1},"status":"discard","description":"Fourth confirmation of combined source-state observation; deterministic work matched the retained candidate","timestamp":1787217392734,"segment":0,"confidence":3.749919781129144,"asi":{"hypothesis":"fourth confirmation repeat of porcelain-v2 HEAD and clean-tree observation reuse","rollback_reason":"primary work_units equal to current best; no candidate source changes were introduced","next_action_hint":"candidate remains stable at 66654; do not introduce an unsafe shortcut merely to force a new improvement"}}
{"run":31,"commit":"4b11f4f","metric":66654,"metrics":{"scale_100_work_units":618,"scale_1000_work_units":6018,"scale_10000_work_units":60018,"git_calls":33,"file_reads":11109,"bytes_hashed":2229591,"canonical_mismatches":0,"private_value_leaks":0,"deterministic_runs":1},"status":"discard","description":"Fifth confirmation of combined source-state observation; deterministic work matched the retained candidate","timestamp":1787217583011,"segment":0,"confidence":3.7497298027560118,"asi":{"hypothesis":"fifth confirmation repeat of porcelain-v2 HEAD and clean-tree observation reuse","rollback_reason":"primary work_units equal to current best; no candidate source changes were introduced","next_action_hint":"candidate remains stable at 66654; avoid forcing a benchmark-only change"}}
{"run":32,"commit":"4b11f4f","metric":66654,"metrics":{"scale_100_work_units":618,"scale_1000_work_units":6018,"scale_10000_work_units":60018,"git_calls":33,"file_reads":11109,"bytes_hashed":2229591,"canonical_mismatches":0,"private_value_leaks":0,"deterministic_runs":1},"status":"discard","description":"Sixth confirmation of combined source-state observation; deterministic work matched the retained candidate","timestamp":1787217761855,"segment":0,"confidence":5.995355869964359,"asi":{"hypothesis":"sixth confirmation repeat of porcelain-v2 HEAD and clean-tree observation reuse","rollback_reason":"primary work_units equal to current best; no candidate source changes were introduced","next_action_hint":"candidate remains stable at 66654; do not overfit or force a lower metric by weakening invalidation"}}
{"run":33,"commit":"4b11f4f","metric":66654,"metrics":{"scale_100_work_units":618,"scale_1000_work_units":6018,"scale_10000_work_units":60018,"git_calls":33,"file_reads":11109,"bytes_hashed":2229591,"canonical_mismatches":0,"private_value_leaks":0,"deterministic_runs":1},"status":"discard","description":"Seventh confirmation of combined source-state observation; deterministic work matched the retained candidate","timestamp":1787217938174,"segment":0,"confidence":14.964550478501145,"asi":{"hypothesis":"seventh confirmation repeat of porcelain-v2 HEAD and clean-tree observation reuse","rollback_reason":"primary work_units equal to current best; no candidate source changes were introduced","next_action_hint":"candidate remains stable at 66654; do not force a benchmark-only optimization"}}
{"run":34,"commit":"4b11f4f","metric":66654,"metrics":{"scale_100_work_units":618,"scale_1000_work_units":6018,"scale_10000_work_units":60018,"git_calls":33,"file_reads":11109,"bytes_hashed":2229591,"canonical_mismatches":0,"private_value_leaks":0,"deterministic_runs":1},"status":"discard","description":"Eighth confirmation of combined source-state observation; deterministic work matched the retained candidate","timestamp":1787218115025,"segment":0,"confidence":29.836603063692557,"asi":{"hypothesis":"eighth confirmation repeat of porcelain-v2 HEAD and clean-tree observation reuse","rollback_reason":"primary work_units equal to current best; no candidate source changes were introduced","next_action_hint":"candidate remains stable at 66654; do not force a benchmark-only optimization"}}
{"run":35,"commit":"4b11f4f","metric":66654,"metrics":{"scale_100_work_units":618,"scale_1000_work_units":6018,"scale_10000_work_units":60018,"git_calls":33,"file_reads":11109,"bytes_hashed":2229591,"canonical_mismatches":0,"private_value_leaks":0,"deterministic_runs":1},"status":"discard","description":"Ninth confirmation of combined source-state observation; deterministic work matched the retained candidate","timestamp":1787218291105,"segment":0,"confidence":4827.04347826087,"asi":{"hypothesis":"ninth confirmation repeat of porcelain-v2 HEAD and clean-tree observation reuse","rollback_reason":"primary work_units equal to current best; no candidate source changes were introduced","next_action_hint":"candidate remains stable at 66654; do not force a benchmark-only optimization"}}
{"run":36,"commit":"4b11f4f","metric":66654,"metrics":{"scale_100_work_units":618,"scale_1000_work_units":6018,"scale_10000_work_units":60018,"git_calls":33,"file_reads":11109,"bytes_hashed":2229591,"canonical_mismatches":0,"private_value_leaks":0,"deterministic_runs":1},"status":"discard","description":"Tenth confirmation of combined source-state observation; deterministic work matched the retained candidate","timestamp":1787218499129,"segment":0,"confidence":4827.04347826087,"asi":{"hypothesis":"tenth confirmation repeat of porcelain-v2 HEAD and clean-tree observation reuse","rollback_reason":"primary work_units equal to current best; no candidate source changes were introduced","next_action_hint":"candidate remains stable at 66654; the remaining work-unit terms are required output or one-time exact reads, so do not weaken safety guards"}}
{"run":37,"commit":"4b11f4f","metric":66654,"metrics":{"scale_100_work_units":618,"scale_1000_work_units":6018,"scale_10000_work_units":60018,"git_calls":33,"file_reads":11109,"bytes_hashed":2229591,"canonical_mismatches":0,"private_value_leaks":0,"deterministic_runs":1},"status":"discard","description":"Eleventh confirmation of combined source-state observation; deterministic work matched the retained candidate","timestamp":1787218671788,"segment":0,"confidence":4827.04347826087,"asi":{"hypothesis":"eleventh confirmation repeat of porcelain-v2 HEAD and clean-tree observation reuse","rollback_reason":"primary work_units equal to current best; no candidate source changes were introduced","next_action_hint":"candidate remains stable at 66654; do not force a benchmark-only optimization"}}
{"run":38,"commit":"4b11f4f","metric":66654,"metrics":{"scale_100_work_units":618,"scale_1000_work_units":6018,"scale_10000_work_units":60018,"git_calls":33,"file_reads":11109,"bytes_hashed":2229591,"canonical_mismatches":0,"private_value_leaks":0,"deterministic_runs":1},"status":"discard","description":"Twelfth confirmation of combined source-state observation; deterministic work matched the retained candidate","timestamp":1787218849615,"segment":0,"confidence":5843.263157894737,"asi":{"hypothesis":"twelfth confirmation repeat of porcelain-v2 HEAD and clean-tree observation reuse","rollback_reason":"primary work_units equal to current best; no candidate source changes were introduced","next_action_hint":"candidate remains stable at 66654; do not force a benchmark-only optimization"}}
{"run":39,"commit":"4b11f4f","metric":66654,"metrics":{"scale_100_work_units":618,"scale_1000_work_units":6018,"scale_10000_work_units":60018,"git_calls":33,"file_reads":11109,"bytes_hashed":2229591,"canonical_mismatches":0,"private_value_leaks":0,"deterministic_runs":1},"status":"discard","description":"Thirteenth confirmation of combined source-state observation; deterministic work matched the retained candidate","timestamp":1787219028683,"segment":0,"confidence":7401.466666666666,"asi":{"hypothesis":"thirteenth confirmation repeat of porcelain-v2 HEAD and clean-tree observation reuse","rollback_reason":"primary work_units equal to current best; no candidate source changes were introduced","next_action_hint":"candidate remains stable at 66654; do not force a benchmark-only optimization"}}
{"run":40,"commit":"4b11f4f","metric":66654,"metrics":{"scale_100_work_units":618,"scale_1000_work_units":6018,"scale_10000_work_units":60018,"git_calls":33,"file_reads":11109,"bytes_hashed":2229591,"canonical_mismatches":0,"private_value_leaks":0,"deterministic_runs":1},"status":"discard","description":"Fourteenth confirmation of combined source-state observation; deterministic work matched the retained candidate","timestamp":1787219207947,"segment":0,"confidence":7401.466666666666,"asi":{"hypothesis":"fourteenth confirmation repeat of porcelain-v2 HEAD and clean-tree observation reuse","rollback_reason":"primary work_units equal to current best; no candidate source changes were introduced","next_action_hint":"candidate remains stable at 66654; do not force a benchmark-only optimization"}}
{"run":41,"commit":"4b11f4f","metric":66654,"metrics":{"scale_100_work_units":618,"scale_1000_work_units":6018,"scale_10000_work_units":60018,"git_calls":33,"file_reads":11109,"bytes_hashed":2229591,"canonical_mismatches":0,"private_value_leaks":0,"deterministic_runs":1},"status":"discard","description":"Fifteenth confirmation of combined source-state observation; deterministic work matched the retained candidate","timestamp":1787219382463,"segment":0,"confidence":7401.466666666666,"asi":{"hypothesis":"fifteenth confirmation repeat of porcelain-v2 HEAD and clean-tree observation reuse","rollback_reason":"primary work_units equal to current best; no candidate source changes were introduced","next_action_hint":"candidate remains stable at 66654; do not force a benchmark-only optimization"}}
{"run":42,"commit":"4b11f4f","metric":66654,"metrics":{"scale_100_work_units":618,"scale_1000_work_units":6018,"scale_10000_work_units":60018,"git_calls":33,"file_reads":11109,"bytes_hashed":2229591,"canonical_mismatches":0,"private_value_leaks":0,"deterministic_runs":1},"status":"discard","description":"Sixteenth confirmation of combined source-state observation; deterministic work matched the retained candidate","timestamp":1787219563080,"segment":0,"confidence":8223.851851851852,"asi":{"hypothesis":"sixteenth confirmation repeat of porcelain-v2 HEAD and clean-tree observation reuse","rollback_reason":"primary work_units equal to current best; no candidate source changes were introduced","next_action_hint":"candidate remains stable at 66654; do not force a benchmark-only optimization"}}
{"run":43,"commit":"4b11f4f","metric":66654,"metrics":{"scale_100_work_units":618,"scale_1000_work_units":6018,"scale_10000_work_units":60018,"git_calls":33,"file_reads":11109,"bytes_hashed":2229591,"canonical_mismatches":0,"private_value_leaks":0,"deterministic_runs":1},"status":"discard","description":"Seventeenth confirmation of combined source-state observation; deterministic work matched the retained candidate","timestamp":1787219743967,"segment":0,"confidence":9251.833333333334,"asi":{"hypothesis":"seventeenth confirmation repeat of porcelain-v2 HEAD and clean-tree observation reuse","rollback_reason":"primary work_units equal to current best; no candidate source changes were introduced","next_action_hint":"candidate remains stable at 66654; do not force a benchmark-only optimization"}}
{"run":44,"commit":"4b11f4f","metric":66654,"metrics":{"scale_100_work_units":618,"scale_1000_work_units":6018,"scale_10000_work_units":60018,"git_calls":33,"file_reads":11109,"bytes_hashed":2229591,"canonical_mismatches":0,"private_value_leaks":0,"deterministic_runs":1},"status":"discard","description":"Eighteenth confirmation of combined source-state observation; deterministic work matched the retained candidate","timestamp":1787219923943,"segment":0,"confidence":9251.833333333334,"asi":{"hypothesis":"eighteenth confirmation repeat of porcelain-v2 HEAD and clean-tree observation reuse","rollback_reason":"primary work_units equal to current best; no candidate source changes were introduced","next_action_hint":"candidate remains stable at 66654; do not force a benchmark-only optimization"}}
{"run":45,"commit":"4b11f4f","metric":66654,"metrics":{"scale_100_work_units":618,"scale_1000_work_units":6018,"scale_10000_work_units":60018,"git_calls":33,"file_reads":11109,"bytes_hashed":2229591,"canonical_mismatches":0,"private_value_leaks":0,"deterministic_runs":1},"status":"discard","description":"Nineteenth confirmation of combined source-state observation; deterministic work matched the retained candidate","timestamp":1787220105547,"segment":0,"confidence":9251.833333333334,"asi":{"hypothesis":"nineteenth confirmation repeat of porcelain-v2 HEAD and clean-tree observation reuse","rollback_reason":"primary work_units equal to current best; no candidate source changes were introduced","next_action_hint":"candidate remains stable at 66654; do not force a benchmark-only optimization"}}
{"run":46,"commit":"4b11f4f","metric":66654,"metrics":{"scale_100_work_units":618,"scale_1000_work_units":6018,"scale_10000_work_units":60018,"git_calls":33,"file_reads":11109,"bytes_hashed":2229591,"canonical_mismatches":0,"private_value_leaks":0,"deterministic_runs":1},"status":"discard","description":"Twentieth confirmation of combined source-state observation; deterministic work matched the retained candidate","timestamp":1787220288121,"segment":0,"confidence":10573.52380952381,"asi":{"hypothesis":"twentieth confirmation repeat of porcelain-v2 HEAD and clean-tree observation reuse","rollback_reason":"primary work_units equal to current best; no candidate source changes were introduced","next_action_hint":"candidate remains stable at 66654; do not force a benchmark-only optimization"}}
{"run":47,"commit":"4b11f4f","metric":66654,"metrics":{"scale_100_work_units":618,"scale_1000_work_units":6018,"scale_10000_work_units":60018,"git_calls":33,"file_reads":11109,"bytes_hashed":2229591,"canonical_mismatches":0,"private_value_leaks":0,"deterministic_runs":1},"status":"discard","description":"Twenty-first confirmation of combined source-state observation; deterministic work matched the retained candidate","timestamp":1787220466516,"segment":0,"confidence":12335.777777777777,"asi":{"hypothesis":"twenty-first confirmation repeat of porcelain-v2 HEAD and clean-tree observation reuse","rollback_reason":"primary work_units equal to current best; no candidate source changes were introduced","next_action_hint":"candidate remains stable at 66654; do not force a benchmark-only optimization"}}
{"run":48,"commit":"4b11f4f","metric":66654,"metrics":{"scale_100_work_units":618,"scale_1000_work_units":6018,"scale_10000_work_units":60018,"git_calls":33,"file_reads":11109,"bytes_hashed":2229591,"canonical_mismatches":0,"private_value_leaks":0,"deterministic_runs":1},"status":"discard","description":"Evaluate a per-repository discovery cache with strict commit, policy, and manifest invalidation; benchmark work was unchanged","timestamp":1787224271449,"segment":0,"confidence":12335.777777777777,"asi":{"hypothesis":"replace the single discovery cache slot with one bounded exact-identity entry per repository, preserving commit/policy/source-manifest invalidation","rollback_reason":"primary work_units unchanged because the frozen workload does not revisit an earlier repository; canonical output and checks remained safe","next_action_hint":"per-repository cache is behaviorally safe but not a frozen-workload win; next isolate metadata batching or stop rather than repeat the same benchmark"}}
{"run":49,"commit":"4b11f4f","metric":66654,"metrics":{"scale_100_work_units":618,"scale_1000_work_units":6018,"scale_10000_work_units":60018,"git_calls":33,"file_reads":11109,"bytes_hashed":2229591,"canonical_mismatches":0,"private_value_leaks":0,"deterministic_runs":1},"status":"discard","description":"Cache exact clean operation evidence by repository, commit, policy, manifest, and operation identity","timestamp":1787228603728,"segment":0,"confidence":12335.777777777777,"asi":{"hypothesis":"reuse the exact operation-evidence result from build_index for the later standalone operation_evidence call when repository state, policy, source manifest, and operation identity all match","rollback_reason":"primary work_units unchanged at 66654; the attempted cache did not produce a frozen-workload improvement","next_action_hint":"instrument the exact cache identity or pursue a different structural-scan reduction; do not repeat this uninstrumented cache variation"}}
